<?xml version="1.0" encoding="utf-8"?>

<structure xmlns="https://github.com/jsjlewis96/project"
           xmlns:xsi="http://www.w3.org/2001/XMLSchema-instance"
           xsi:schemaLocation="https://github.com/jsjlewis96/project workspaceConfigSchema.xsd">
    <config>
        <project>testProject</project>
        <root>rootPath</root>
        <target>targetPath</target>
    </config>
    <dirsRoot>
        <dir>
            <name>Management</name>
            <dirs>
                <dir>
                    <prefix>MS</prefix>
                    <separator>.</separator>
                    <name>Project Schedule</name>
                    <dirs>
                        <dir>
                            <prefix>1</prefix>
                            <name>Gantt Chart</name>
                        </dir>
                        <dir>
                            <prefix>2</prefix>
                            <name>Process Matrix</name>
                        </dir>
                    </dirs>
                </dir>
            </dirs>
        </dir>
        <dir>
            <name>Tech</name>
            <dirs>
                <dir>
                    <prefix>TQ</prefix>
                    <separator>.</separator>
                    <name>Peer Review</name>
                    <dirs>
                        <dir>
                            <prefix>1</prefix>
                            <name>Code Review</name>
                        </dir>
                        <dir>
                            <prefix>2</prefix>
                            <name>Design Review</name>
                        </dir>
                    </dirs>
                </dir>
                <dir>
                    <prefix>TS</prefix>
                    <separator>.</separator>
                    <name>System Design Spec</name>
                    <dirs>
                        <dir>
                            <prefix>1</prefix>
                            <separator>-</separator>
                            <name>System and Subsystem Design Description</name>
                            <dirs>
                                <dir>
                                    <prefix>01</prefix>
                                    <name>File Structure Project SSDD</name>
                                </dir>
                                <dir>
                                    <prefix>02</prefix>
                                    <name>OTHER PROJECT SSDD</name>
                                </dir>
                            </dirs>
                        </dir>
                        <dir>
                            <prefix>2</prefix>
                            <name>OTHER DESIGN SPEC DOCS</name>
                        </dir>
                    </dirs>
                </dir>
            </dirs>
        </dir>
    </dirsRoot>
</structure>